{
  "batchId": "pilot-arctic-domain-awareness-2026-04-24",
  "title": "Arctic Domain Awareness Real-Data Pilot",
  "status": "candidate",
  "createdAt": "2026-04-24T00:00:00.000Z",
  "researchScope": {
    "description": "Small public-source pilot for Arctic domain awareness, underwater ISR, autonomous patrol, and edge mission software. This batch is reviewable candidate data only and is not approved seed data.",
    "useCaseIds": ["use-case-1", "use-case-3", "use-case-4", "use-case-5"],
    "domainIds": ["domain-1", "domain-2", "domain-4"]
  },
  "guardrailNotes": [
    "Public-source alignment only; this batch does not imply classified CAF, DND, NORAD, NATO, or procurement targeting.",
    "Company and capability records use canonical public URLs and paraphrased evidence snippets.",
    "Candidate records are intentionally staged outside app/supabase/seed until a human reviewer approves import."
  ],
  "companies": [
    {
      "id": "pilot-company-kraken-robotics",
      "slug": "kraken-robotics",
      "name": "Kraken Robotics",
      "overview": "Canadian subsea technology company with synthetic aperture sonar, underwater imaging, subsea power, and robotic systems relevant to underwater awareness and autonomous maritime operations.",
      "geography": "canada",
      "headquarters": "St. John's Newfoundland and Labrador Canada",
      "market_context": "Useful candidate for underwater ISR and Arctic maritime awareness where high-resolution seabed or subsea detection data supports operator decisions.",
      "website_url": "https://www.krakenrobotics.com/",
      "public_contact_email": null,
      "public_contact_phone": null,
      "last_updated_at": "2026-04-24T00:00:00.000Z",
      "confidence": "high",
      "research_rationale": "Official product and company release pages describe synthetic aperture sonar and subsea systems with defence and maritime security relevance."
    },
    {
      "id": "pilot-company-mda-space",
      "slug": "mda-space",
      "name": "MDA Space",
      "overview": "Canadian space and mission systems company with Earth observation, radar, space robotics, satellite operations, and maritime awareness capabilities.",
      "geography": "canada",
      "headquarters": "Brampton Ontario Canada",
      "market_context": "Relevant to Arctic domain awareness where persistent all-weather overhead observation and maritime monitoring support sparse northern coverage.",
      "website_url": "https://mda.space/",
      "public_contact_email": null,
      "public_contact_phone": null,
      "last_updated_at": "2026-04-24T00:00:00.000Z",
      "confidence": "high",
      "research_rationale": "Official MDA pages and public contract reporting support the Earth observation and maritime awareness connection."
    },
    {
      "id": "pilot-company-cellula-robotics",
      "slug": "cellula-robotics",
      "name": "Cellula Robotics",
      "overview": "Canadian underwater robotics company developing long-endurance autonomous underwater vehicles and related subsea autonomy systems.",
      "geography": "canada",
      "headquarters": "Burnaby British Columbia Canada",
      "market_context": "Relevant to underwater ISR and autonomous patrol where endurance and autonomous subsea operation are mission constraints.",
      "website_url": "https://cellula.com/",
      "public_contact_email": null,
      "public_contact_phone": null,
      "last_updated_at": "2026-04-24T00:00:00.000Z",
      "confidence": "moderate",
      "research_rationale": "Official product pages support long-endurance AUV capability, but mission fit still needs operator validation."
    },
    {
      "id": "pilot-company-kongsberg-geospatial",
      "slug": "kongsberg-geospatial",
      "name": "Kongsberg Geospatial",
      "overview": "Ottawa-based geospatial software company providing airspace visualization, unmanned systems awareness, and mission display software for complex operations.",
      "geography": "canada",
      "headquarters": "Ottawa Ontario Canada",
      "market_context": "Relevant to autonomous patrol and edge data processing where operators need fused situational awareness for uncrewed systems and degraded-connectivity missions.",
      "website_url": "https://www.kongsberggeospatial.com/",
      "public_contact_email": null,
      "public_contact_phone": null,
      "last_updated_at": "2026-04-24T00:00:00.000Z",
      "confidence": "high",
      "research_rationale": "Official product pages describe IRIS Terminal and related unmanned systems visualization functions."
    },
    {
      "id": "pilot-company-geospectrum-technologies",
      "slug": "geospectrum-technologies",
      "name": "GeoSpectrum Technologies",
      "overview": "Nova Scotia underwater acoustics company offering sonar, acoustic sensors, and defence surveillance systems for surface and subsea applications.",
      "geography": "canada",
      "headquarters": "Dartmouth Nova Scotia Canada",
      "market_context": "Relevant to underwater ISR and maritime surveillance where compact active-passive sonar can support ships, ships of opportunity, and uncrewed surface platforms.",
      "website_url": "https://geospectrum.ca/",
      "public_contact_email": null,
      "public_contact_phone": null,
      "last_updated_at": "2026-04-24T00:00:00.000Z",
      "confidence": "high",
      "research_rationale": "Official GeoSpectrum TRAPS page describes active-passive sonar capability for defence and surveillance use."
    },
    {
      "id": "pilot-company-open-ocean-robotics",
      "slug": "open-ocean-robotics",
      "name": "Open Ocean Robotics",
      "overview": "Canadian marine robotics company developing autonomous uncrewed surface vehicles and maritime data services for persistent ocean monitoring.",
      "geography": "canada",
      "headquarters": "Victoria British Columbia Canada",
      "market_context": "Relevant to maritime domain awareness where persistent uncrewed surface collection can extend coverage without staffed vessels.",
      "website_url": "https://www.openoceanrobotics.com/",
      "public_contact_email": null,
      "public_contact_phone": null,
      "last_updated_at": "2026-04-24T00:00:00.000Z",
      "confidence": "moderate",
      "research_rationale": "Official company pages and industry reporting support maritime awareness relevance, but operational maturity should be validated before procurement-facing treatment."
    }
  ],
  "capabilities": [
    {
      "id": "pilot-capability-kraken-katfish-sas",
      "company_id": "pilot-company-kraken-robotics",
      "slug": "kraken-katfish-sas",
      "name": "KATFISH Towed Synthetic Aperture Sonar",
      "capability_type": "Towed Synthetic Aperture Sonar",
      "domain_id": "domain-2",
      "summary": "Actively stabilized towed synthetic aperture sonar system for high-resolution underwater survey, seabed imaging, and subsea object detection.",
      "company_facing_context": "Best reviewed for underwater ISR, route survey, seabed change detection, and mine or subsea infrastructure awareness use cases.",
      "last_updated_at": "2026-04-24T00:00:00.000Z",
      "confidence": "high",
      "research_rationale": "Official product documentation describes resolution, area coverage, and real-time SAS data characteristics."
    },
    {
      "id": "pilot-capability-mda-chorus-sar",
      "company_id": "pilot-company-mda-space",
      "slug": "mda-chorus-sar",
      "name": "MDA CHORUS Synthetic Aperture Radar Constellation",
      "capability_type": "Earth Observation SAR Constellation",
      "domain_id": "domain-2",
      "summary": "Next-generation C-band and X-band synthetic aperture radar constellation intended to provide all-weather day-night Earth observation data.",
      "company_facing_context": "Best reviewed as an overhead sensing layer for Arctic awareness, maritime monitoring, and distributed sensor fusion.",
      "last_updated_at": "2026-04-24T00:00:00.000Z",
      "confidence": "high",
      "research_rationale": "Official CHORUS page describes the SAR constellation design and public reporting connects MDA services to maritime awareness."
    },
    {
      "id": "pilot-capability-cellula-envoy-auv",
      "company_id": "pilot-company-cellula-robotics",
      "slug": "cellula-envoy-auv",
      "name": "Envoy Long-Endurance Autonomous Underwater Vehicle",
      "capability_type": "Autonomous Underwater Vehicle",
      "domain_id": "domain-1",
      "summary": "Long-endurance fuel-cell autonomous underwater vehicle designed for persistent subsea missions and extended underwater operation.",
      "company_facing_context": "Best reviewed for undersea route reconnaissance, subsea infrastructure monitoring, and extended underwater patrol validation.",
      "last_updated_at": "2026-04-24T00:00:00.000Z",
      "confidence": "moderate",
      "research_rationale": "Official product page supports endurance and AUV framing, while defence mission suitability still needs validation evidence."
    },
    {
      "id": "pilot-capability-kongsberg-iris-terminal",
      "company_id": "pilot-company-kongsberg-geospatial",
      "slug": "kongsberg-iris-terminal",
      "name": "IRIS Terminal Airspace Visualization",
      "capability_type": "Mission Visualization Software",
      "domain_id": "domain-4",
      "summary": "Airspace visualization and situational awareness software that combines sensor, telemetry, and air traffic inputs for uncrewed operations.",
      "company_facing_context": "Best reviewed for uncrewed system deconfliction, BVLOS test ranges, and local mission visualization in complex operations.",
      "last_updated_at": "2026-04-24T00:00:00.000Z",
      "confidence": "high",
      "research_rationale": "Official product page describes sensor and telemetry fusion for airspace management and unmanned operations."
    },
    {
      "id": "pilot-capability-geospectrum-traps",
      "company_id": "pilot-company-geospectrum-technologies",